Project Name,Customer Name,Connection Site,Node_Name,Node Assumed,Project Number
Lullington Solar,LIGHTSOURCE RENEWABLE UK DEVELOPMENT LIMITED,Drakelow 400kV Substation,DRAK4,,PRO-002225
Powersite @ Drakelow,POWERSITE LTD,Drakelow 400kV Substation,DRAK4,,PRO-000364
Drakelow Power Station 1 BESS,Bluestone Energy Ltd,Drakelow GSP,DRAK1,,PRO-004063
Drax,ENSO GREEN HOLDINGS D LIMITED,Drax 132kV Substation,DRAX4,,PRO-001355
Lakeside Energy Drax,LAKESIDE ENERGY STORAGE LIMITED,Drax 132kV Substation,DRAX1,,PRO-001522
Drax Power Station,DRAX POWER LIMITED,Drax 400kV Substation,DRAX4,,PRO-000129
Drax Solar,BOOM DEVELOPMENTS LTD,Drax 400kV Substation,DRAX4,,PRO-001759
Drum of Clunas Wind and Solar Park,BROADHAVEN DISTRIBUTION LIMITED,Drum of Clunas 275kV,,,PRO-003970
Whitehill Estate BESS 60MW,GPC 013 LTD,Drumchapel 275/33kV,DRUM3,,PRO-003420
Hill of Towie/Drummuir,HILL OF TOWIE LIMITED,Drummuir Windfarm at Keith 33kV Grid Supply Point,KEIT3,,PRO-000234
Dalswinton,DALSWINTON WINDFARM (SCOTLAND) LIMITED,Dumfries 132/33kV,DUMF3,,PRO-000118
Dalswinton WindFarm Extension,DALSWINTON WINDFARM (SCOTLAND) LIMITED,Dumfries 132/33kV,DUMF3,,PRO-004393
Windy Standard II (Brockloch Rig) Wind Farm,BROCKLOCH RIG WINDFARM LIMITED,Dun Hill 132/33kV,DUNH3,,PRO-000233-1
Windy Standard II (Brockloch Rig) Wind Farm,BROCKLOCH RIG WINDFARM LIMITED,Dun Hill 132/33kV,DUNH3,,PRO-000233-2
Windy Standard III Wind Farm,Windy Standard III Ltd,Dun Hill 132/33kV,DUNH3,,PRO-000359-1
Windy Standard III Wind Farm,Windy Standard III Ltd,Dun Hill 132/33kV,DUNH3,,PRO-000359-2
Windy Standard III Wind Farm,Windy Standard III Ltd,Dun Hill 132/33kV,DUNH3,,PRO-000359-3
Dunan Hill,ORSTED ONSHORE UK LIMITED,Dunan Hill 400kV substation,,,PRO-004433
Outh Muir Energy Park,Grupotec Renewables Limited,Dunfermline 132/33kV,DUNF3,,PRO-002456
Dungeness B,EDF ENERGY NUCLEAR GENERATION LIMITED,Dungeness 275kV Substation,DUNG2,,PRO-000133
BLUE PLANET SOLAR,BLUE PLANET SOLAR LIMITED,Dungeness 400kV Substation,DUNG4,,PRO-001703
Dungeness Energy Park (Dungeness 400kV),SOUTH KENT ENERGY PARK LIMITED,Dungeness 400kV Substation,DUNG4,,PRO-005021
Dunlaw Extension,SCOTTISHPOWER RENEWABLES (UK) LIMITED,Dunlaw Extension 132/33kV,DUNE3,,PRO-000061
Fort Dunlop,WHITETOWER ENERGY LIMITED,Dunlop 132kV Substation,,,PRO-000160
Dunmaglass Wind Farm,DUNMAGLASS WIND FARM LIMITED,Dunmaglass 132kV Substation,DUNM1,,PRO-000076
Giants Burn Wind Farm,STATKRAFT UK LTD,Dunoon GSP,DUNO3,,PRO-002232
Hipsey BESS,KONA ASSET 2 LIMITED,Dunstable 400kV Substation,SUND4,Y,PRO-003051
Hockliffe GEC (Ethos Green),HOCKLIFFE GREEN ENERGY CENTRE LTD,Dunstable 400kV Substation,SUND4,Y,PRO-004342
Sundon Farm,548 UK INVESTMENT HOLDINGS LIMITED,Dunstable 400kV Substation,SUND4,Y,PRO-002685
Sundon Farm 2,548 UK INVESTMENT HOLDINGS LIMITED,Dunstable 400kV Substation,SUND4,Y,PRO-002746
Woburn Solar Farm,SolarThree Ltd,Dunstable 400kV Substation,SUND4,Y,PRO-003033
Kincraig Energy Centre,Kincraig Energy Centre Limited,Dyce GSP,DYCE3,,PRO-001810
Perwinnes,INNOVA RENEWABLES LIMITED,Dyce GSP,DYCE3,,PRO-001934
East Anglia One North,EAST ANGLIA ONE LIMITED,EA1N 275/66kV Offshore Platform,FRIS4,Y,PRO-000269
East Anglia Two,EAST ANGLIA TWO LIMITED,EA2A and EA2B 275/66kV Offshore Platform,FRIS4,Y,PRO-000134-1
East Anglia Two,EAST ANGLIA TWO LIMITED,EA2A and EA2B 275/66kV Offshore Platform,FRIS4,Y,PRO-000134-2
Earba PSH,EARBA LIMITED,Earba PSH Powerhouse Substation,BEAU1,Y,PRO-004030-1
Earba PSH,EARBA LIMITED,Earba PSH Powerhouse Substation,BEAU1,Y,PRO-004030-2
Earl Shilton BESS,Exagen Development Limited,Earl Shilton 275kV,ENDE4,Y,PRO-001950
Enderby BESS,EARL SHILTON ENERGY PARK LIMITED,Earl Shilton 400kV Substation,ENDE4,Y,PRO-003872
Enderby Farm,548 UK INVESTMENT HOLDINGS LIMITED,Earl Shilton 400kV Substation,ENDE4,Y,PRO-002682
Enderby Farm 2,548 UK INVESTMENT HOLDINGS LIMITED,Earl Shilton 400kV Substation,ENDE4,Y,PRO-002743
Lower Pool Energy Park,Renewable Energy Systems Limited,Earl Shilton 400kV Substation,ENDE4,Y,PRO-003586
Earraghail Renewable Energy Development (formerly Skipness & Corranbuie),SCOTTISHPOWER RENEWABLES (UK) LIMITED,Earraghail 275/33KV Substation,EARR3,,PRO-001139
Manor Farm,QAIR RENEWABLES UK LIMITED,East Anglia Connection Node E 400kV Substation,,,PRO-004269
East Anglia Three,EAST ANGLIA THREE LIMITED,East Anglia Project Three Offshore Platform,BRFO4,Y,PRO-000270-1
East Anglia Three,EAST ANGLIA THREE LIMITED,East Anglia Project Three Offshore Platform,BRFO4,Y,PRO-000270-2
Alderton PV & BESS Station,BNRG ALBION LIMITED,East Claydon 400kV Substation,ECLA4,,PRO-002764
BF88 Oakley,BLUEFIELD RENEWABLE DEVELOPMENTS LIMITED,East Claydon 400kV Substation,ECLA4,,PRO-004319
East Claydon Green Energy Centre,INNOVA RENEWABLES LIMITED,East Claydon 400kV Substation,ECLA4,,PRO-002383
East Claydon Greener Grid Park,STATKRAFT UK LTD,East Claydon 400kV Substation,ECLA4,,PRO-002314
East Claydon High Impact Green Energy Hub (HIGEH) 1,TELIS ENERGY UK LIMITED,East Claydon 400kV Substation,ECLA4,,PRO-002652
East Claydon Solar PV,STATERA ENERGY LIMITED,East Claydon 400kV Substation,ECLA4,,PRO-001573
Rosefield,Rosefield Energyfarm Limited,East Claydon 400kV Substation,ECLA4,,PRO-001044
Sulgrave Solar PV,EDF ENERGY RENEWABLES LIMITED,East Claydon GSP (SEPD),ECLA1,,PRO-001572
Dungeness Energy Park,SOUTH KENT ENERGY PARK LIMITED,East Kent connection node A 400kV Substation,CANT4,Y,PRO-001986
Fairmead and Yewtree Farm,QAIR RENEWABLES UK LIMITED,East Kent connection node A 400kV Substation,CANT4,Y,PRO-004291
GF SELLINDGE BESS,GF Sellindge Energy Ltd,East Kent connection node A 400kV Substation,CANT4,Y,PRO-004228
Lightsource Newchurch PV/BESS,LIGHTSOURCE RENEWABLE UK DEVELOPMENT LIMITED,East Kent connection node A 400kV Substation,CANT4,Y,PRO-003717
Sellindge West,Sellindge West 10 Renewables Limited,East Kent connection node A 400kV Substation,CANT4,Y,PRO-003412
Canterbury North,Canterbury North 10 Renewables Limited,East Kent Connection Node B 400kV Substation,CANT4,Y,PRO-003414
Project Invicta,The Farm Energy Company Limited,East Kent Connection Node B 400kV Substation,CANT4,Y,PRO-004133
Rogerton Cottage BESS,GPC 680 Ltd,East Kilbride 275/33kV,EKIL3,,PRO-003543
Rutherend Farm,ECOCEL ENERGY (STORAGE) LTD,East Kilbride 275kV Substation,EKIL2,,PRO-004530
AGS Nerston 2 BESS,Advance Grid Solutions Limited,East Kilbride B 275/33kV Substation,EKIS3,,PRO-004226
AGS Nerston 3 BESS,Advance Grid Solutions Limited,East Kilbride B 275/33kV Substation,EKIS3,,PRO-004227
AGS Nerston BESS,Advance Grid Solutions Limited,East Kilbride B 275/33kV Substation,EKIS3,,PRO-004216
Whitehill Battery Storage,Whitehill Battery Storage Ltd,Easterhouse 275/33kV,EERH3,,PRO-002093
Coddington,STARLIGHT ENERGY UK LIMITED,Eaton Socon 400kV Substation,EASO4,,PRO-003750
Eaton Socon High Impact Green Energy Hub (HIGEH) 1,TELIS ENERGY UK LIMITED,Eaton Socon 400kV Substation,EASO4,,PRO-002656
Eaton Socon PV Storage,CSE37 Limited,Eaton Socon 400kV Substation,EASO4,,PRO-002218
Eaton Socon Solar,BROCKWELL STORAGE & SOLAR LIMITED,Eaton Socon 400kV Substation,EASO4,,PRO-001513
Little Barford,RWE GENERATION UK PLC,Eaton Socon 400kV Substation,EASO4,,PRO-000125
Bankhead BESS,Apatura Battery Ltd,Eccles 132/33kV,ECCL3,,PRO-003236
Eccles BESS,WEAVER POWER LIMITED,Eccles 132/33kV,ECCL3,,PRO-001470
Zenobe Eccles Battery Storage,Zenobe Eccles Limited,Eccles 132/33kV,ECCL3,,PRO-001779
AMP Eccles BESS,Eccles Grid Stability Limited,Eccles 400/132kV,ECCL1,,PRO-003836
Coldstream BESS,IGP ENERGY STORAGE 4 LIMITED,Eccles 400/132kV,ECCL1,,PRO-003572
Land at Leitholm,NOVENTUM POWER SOLAR 6 LIMITED,Eccles 400/132kV,ECCL1,,PRO-004265
Pittlesheugh Farm,C A Ramsay Partnership,Eccles 400/132kV,ECCL1,,PRO-002547
Edinbane Windfarm,VATTENFALL WIND POWER LTD,Edinbane 132/33kV Substation,EDIN3,,PRO-000135-1
Edinbane Windfarm,VATTENFALL WIND POWER LTD,Edinbane 132/33kV Substation,EDIN3,,PRO-000135-2
Gleann Eoghainn,RENANTIS UK LIMITED,Edinbane 132/33kV Substation,EDIN3,,PRO-001275
Glenmore,AEUK WIND PROJECT II LTD,Edinbane 132/33kV Substation,EDIN3,,PRO-004445
Eggborough,SSE EGGBOROUGH LIMITED,Eggborough 400kV Substation,EGGB4,,PRO-002049
Eggborough BESS,Fig Power Limited,Eggborough 400kV Substation,EGGB4,,PRO-004997
Eggborough CCGT and BESS,EGGBOROUGH POWER LIMITED,Eggborough 400kV Substation,EGGB4,,PRO-000136-1
Eggborough CCGT and BESS,EGGBOROUGH POWER LIMITED,Eggborough 400kV Substation,EGGB4,,PRO-000136-2
Elchies Wind Farm,ELCHIES WIND LIMITED,Elchies 132/33kV Substation,ELCH3,,PRO-000151-1
Elchies Wind Farm,ELCHIES WIND LIMITED,Elchies 132/33kV Substation,ELCH3,,PRO-000151-2
Middleton Farm Solar,Bluestone Energy Ltd,Elderslie 132/33kV,ELDE3,,PRO-003977
Well Street Paisley,Gas Generation Property Limited,Elderslie 132/33kV,ELDE3,,PRO-002265
Elgin BESS,GPC 612 Ltd,Elgin GSP,ELGI3,,PRO-002650
Elland BESS,O&G Solar (SPV 39) Limited,Elland 132kV Substation,ELLA1,,PRO-003870
Elmya Grange Road,ELMYA RPC UK GRANGE ROAD LIMITED,Elmya Grange 400kV,,,PRO-002340
Elmya Morningside BESS & PV,ELMYA RPC UK MORNINGSIDE LIMITED,Elmya Morningside 400kV Substation,,,PRO-004396
Elstree Energy Storage,BW ESS DEVELOPMENT UK LIMITED,Elstree 132kV Substation,ELST1,,PRO-003205
Elstree (tertiary),ELSTREE GREEN LIMITED,Elstree 275kV Substation,ELST2,,PRO-000400
Elstree 400MW BESS,DC01 UK Limited,Elstree 400kV Substation,ELST4,,PRO-002169
Elstree BESS NP,NORIKER POWER LTD,Elstree 400kV Substation,ELST4,,PRO-002776
Riverside Industrial Estate,ZURICH ASSURANCE LTD,Elstree B 275/132kV,ELST1,,PRO-004605
Weaver Island 150MW BESS,Bluestone Energy Ltd,Elton (Merseyside 132kV Substation),,,PRO-002714
Protos Power Station,KEADBY GENERATION LIMITED,Elton 400kV Substation,,,PRO-002823
Elvanfoot (25MW) Energy Storage,ELVANFOOT ENERGY STORAGE LIMITED,Elvanfoot 275/132/33kV,ELVA3,,PRO-003278
Elvanfoot (50MW) Energy Storage,ELVANFOOT ENERGY STORAGE LIMITED,Elvanfoot 275/132/33kV,ELVA3,,PRO-003279
Priestgill Wind Farm,PRIESTGILL WIND FARM LIMITED,Elvanfoot 275/132/33kV,ELVA3,,PRO-000448
Ravengill Renewable Energy Park,RENEWCO POWER LIMITED,Elvanfoot 275/132/33kV,ELVA3,,PRO-004257
Elvanfoot (9.8 MW) Energy Storage,ELVANFOOT ENERGY STORAGE LIMITED,Elvanfoot 400/275/33kV,ELVA3,,PRO-001721
Enderby (Akira),ENDERBY BATTERY STORAGE LIMITED,Enderby 400kV Substation,ENDE4,,PRO-000426
Enderby Green Energy Centre,INNOVA RENEWABLES LIMITED,Enderby 400kV Substation,ENDE4,,PRO-002177
Enderby Solar & BESS,GREENTECH PROJECTS HOLDING UK LIMITED,Enderby 400kV Substation,ENDE4,,PRO-004540
Enderby Tertiary,CLUMP FARM SOLAR LIMITED,Enderby 400kV Substation,ENDE4,,PRO-000430
Rugby High Impact Green Energy Hub (HIGEH) 1,TELIS ENERGY UK LIMITED,Enderby 400kV Substation,ENDE4,,PRO-003626
Energy Isles,ENERGY ISLES SHETLAND LIMITED,Energy Isles 132kV Substation,ENEI1,,PRO-000447
Enoch Hill,RWE RENEWABLES UK ONSHORE WIND LIMITED,Enoch Hill 132/33kV Substation,ENHI3,,PRO-000152
EOLFI Offshore,Shell New Energies UK Ltd,Eolfi Offshore Substation,TEAL4,,PRO-001538
ER BBR Energy,ER PROJECT DEVELOPMENT CO LIMITED,Er Bbr Energy 132kV Substation,,,PRO-003508
ER MSM Energy,ER PROJECT DEVELOPMENT CO LIMITED,Er Msm Energy 132kV Substation,,,PRO-003480
An Suidhe Wind Farm - Argyll (SRO),AN SUIDHE WIND FARM LIMITED,Eredine GSP,ERED3,,PRO-000009
Errochty,SSE GENERATION LIMITED,Errochty 132kV Substation,ERRO1,,PRO-001541
Kynachan,Geocore Ltd,Errochty 132kV Substation,ERRO1,,PRO-003502
Euchanhead Wind Farm,SCOTTISHPOWER RENEWABLES (UK) LIMITED,Euchanhead 132kV Substation,EUCH1,,PRO-001011
Ewe Hill,SCOTTISHPOWER RENEWABLES (UK) LIMITED,Ewehill 132/33kV,EWEH3,,PRO-001368
Peak Gen Makro Exeter,PEAK GEN POWER 14 LIMITED,Exeter 132kV Substation,EXET1,,PRO-003904
Exeter (Tertiary),PIVOTED POWER LLP,Exeter 400kV Substation,EXET4,,PRO-001047-1
Exeter (Tertiary),PIVOTED POWER LLP,Exeter 400kV Substation,EXET4,,PRO-001047-2
Exeter (Tertiary),PIVOTED POWER LLP,Exeter 400kV Substation,EXET4,,PRO-001047
Exeter Main,ENSO GREEN HOLDINGS LIMITED,Exeter 400kV Substation,EXET4,,PRO-002082
Exeter Main Tertiary,EXETER MAIN BATTERY LIMITED,Exeter 400kV Substation,EXET4,,PRO-000452
Exeter Solar PV & BESS,Exeter Storage Limited,Exeter 400kV Substation,EXET4,,PRO-001666
Jersey Farm BESS,CSE39 LIMITED,Exeter 400kV Substation,EXET4,,PRO-002264
Tale Lane Solar / A008 Langford,JBM SOLAR PROJECTS 2 LTD,Exeter GSP,EXET1,,PRO-004476
Water Lane,VIRIDIS 178 LIMITED,Exeter GSP,EXET1,,PRO-000241
Exeter BESS and PV (Post-Interactivity Revised Offer),IGP SOLAR 20 LIMITED,Exeter Main 400kV Substation,EXET4,,PRO-001827
Fairburn Extension Wind Farm,SSE RENEWABLES SERVICES (UK) LIMITED,Fairburn Extension 132/33kV Substation,ORRI3,,PRO-004012
Fallago Rig 2,EDF ENERGY RENEWABLES LIMITED,Fallago 400/33kV,FALL3,,PRO-000526
Fallago Rig Wind Farm,FALLAGO RIG WINDFARM LIMITED,Fallago 400/33kV,FALL3,,PRO-000155
Fasnakyle G1 & G2,SSE GENERATION LIMITED,Fasnakyle GSP,FASN3,,PRO-000077
Fasnakyle G3 & G4,SSE GENERATION LIMITED,Fasnakyle GSP,FASN3,,PRO-000078
Fasque Windfarm,SCOTTISHPOWER RENEWABLES (UK) LIMITED,Fasque Wind Farm 132kV Substation,FASQ3,,PRO-001009
Faw Side Community Wind Farm,CWP Energy Limited,Faw Side Community Wind Farm Substation,FASI1,,PRO-000297
Copper Nose BESS,Copper Nose Energy Ltd,Fawley 132kV Substation,FAWL1,,PRO-002356
KXP Alpha One,KXP ALPHA I LIMITED,Fawley 132kV Substation,FAWL1,,PRO-002348
KXP Alpha Three,KXP ALPHA III LIMITED,Fawley 132kV Substation,FAWL1,,PRO-002351
KXP Alpha Two,KXP ALPHA II LIMITED,Fawley 132kV Substation,FAWL1,,PRO-002349
Cowes,RWE GENERATION UK PLC,Fawley 400kV Substation,FAWL4,,PRO-000107
Fawley CHP,ESSO PETROLEUM COMPANY LIMITED,Fawley 400kV Substation,FAWL4,,PRO-000157
Lynes Common,RWE COGEN UK (HYTHE) LIMITED,Fawley 400kV Substation,FAWL4,,PRO-000231
Manor Farm Solar Park,CSE42 LIMITED,Fawley GSP,FAWL1,,PRO-002337
Boom Power Feckenham Generation Hub,BOOM POWER LTD,Feckenham 400kV Substation,FECK4,,PRO-002312
Feckenham,ENSO GREEN HOLDINGS LIMITED,Feckenham 400kV Substation,FECK4,,PRO-002189
Feckenham,IGP SOLAR 14 LIMITED,Feckenham 400kV Substation,FECK4,,PRO-001600
Feckenham Energy Park,GREEN ENERGY MAB LTD,Feckenham 400kV Substation,FECK4,,PRO-002378
Feckenham Green Energy Centre,INNOVA RENEWABLES LIMITED,Feckenham 400kV Substation,FECK4,,PRO-001767
Feckenham Greener Grid Park,STATKRAFT UK LTD,Feckenham 400kV Substation,FECK4,,PRO-001008-1
Feckenham Greener Grid Park,STATKRAFT UK LTD,Feckenham 400kV Substation,FECK4,,PRO-001008-2
Feckenham PV & BESS Station,IB VOGT UK LTD,Feckenham 400kV Substation,FECK4,,PRO-003233
Redditch,CINERGY GLOBAL POWER (UK) LIMITED,Feckenham GSP,FECK6,,PRO-000198
Fell Wind Farm,ENERGYFARM UK FELL LLP,Fell Wind Farm 132/33kV Substation,FELL3,,PRO-001755
Ferrybridge B BESS & Solar Substation,O&G Solar (SPV 19) Limited,Ferrybridge B 132kV Substation,FERR1,,PRO-002521
NEL Tiger,Newton Energi Limited,Ferrybridge B 132kV Substation,FERR1,,PRO-002815
SSE Ferrybridge BESS,SSE UTILITY SOLUTIONS LIMITED,Ferrybridge B 132kV Substation,FERR1,,PRO-001614
NEL Springfield,Newton Energi Limited,Ferrybridge B GSP,FERR1,,PRO-003633
Ferrybridge C PV & BESS Substation,O&G Solar (SPV 19) Limited,Ferrybridge C 275kV Substation,FERR2,,PRO-003632
Ferrybridge D,KEADBY GENERATION LIMITED,Ferrybridge C 275kV Substation,FERR2,,PRO-001020-1
Ferrybridge D,KEADBY GENERATION LIMITED,Ferrybridge C 275kV Substation,FERR2,,PRO-001020-2
Ferrybridge D,KEADBY GENERATION LIMITED,Ferrybridge C 275kV Substation,FERR2,,PRO-001020-3
Drumlithie Battery Storage,DRUMLITHIE BATTERY LIMITED,Fetteresso GSP,FETT3,,PRO-002299
Ffestiniog,FIRST HYDRO COMPANY,Ffestiniog 275kV Substation,FFES2,,PRO-000055
Brownieleys,BROWNIELEYS RENEWABLES LLP,Fiddes GSP,FIDD3,,PRO-000086
Fiddes Battery Storage,FIDDES BATTERY LIMITED,Fiddes GSP,FIDD3,,PRO-001831
Meetlaw BESS,CARRAVINDOON LIMITED,Fiddes GSP,FIDD3,,PRO-001966
Nether Pitforthie BESS,OPDE UK LIMITED,Fiddes GSP,FIDD3,,PRO-003226
Twinshiels (Tullo 2) Wind Farm,TWINSHIELS WIND FARM LTD,Fiddes GSP,FIDD3,,PRO-000895
Fiddlers Ferry BESS,FIDDLERS FERRY LTD,Fiddlers Ferry 275kV Substation,FIDF2,,PRO-003897
Penketh Hall Farm,Net Zero One Limited,Fiddlers Ferry 275kV Substation,FIDF2,,PRO-001932
SSE Fiddlers Ferry Battery Energy Storage,SSE FIDDLERS FERRY BATTERY LIMITED,Fiddlers Ferry 275kV Substation,FIDF2,,PRO-001762
Fife Energy Centre,CAMBRIDGE POWER LIMITED,Fife Energy Centre 132kV substation,FIGS2,,PRO-001868
Fife Grid Services,BLUEGRIDPOWER LTD,Fife Grid Services Facility 275kV Substation,FIGS2,,PRO-000453
Kincardine Battery Storage Facility,SPECTRUMRESERVE LTD,Fife Grid Services Facility 275kV Substation,FIGS2,,PRO-000856
Kincardine Energy Storage Facility,ENERGYGRIDPOWER3 LTD,Fife Grid Services Facility 275kV Substation,FIGS2,,PRO-001653
Finlarig,SSE GENERATION LIMITED,Finlarig GSP,FINL5,,PRO-000079-1
Finlarig,SSE GENERATION LIMITED,Finlarig GSP,FINL5,,PRO-000079-2
SEC 1 BESS,Bluestone Energy Ltd,Finnieston 132/33kV,FINN3,,PRO-003198
Five Estuaries Offshore Wind Farm,FIVE ESTUARIES OFFSHORE WIND FARM LIMITED,Five Estuaries 220/66 kV Offshore Substation,EACN4,,PRO-000450
Peak Gen Bracknell,PEAK GEN POWER 11 LIMITED,Fleet 132KV Substation,FLEE1,,PRO-003898
Fleet (Tertiary),CSE23 LIMITED,Fleet 400kV Substation,FLEE4,,PRO-001087
Fleet EGH (Tertiary),Fleet Green Limited,Fleet 400kV Substation,FLEE4,,PRO-000544
Fleet Farm,BASINGSTOKE EAST 2 RENEWABLES LTD,Fleet 400kV Substation,FLEE4,,PRO-002678
Fleet Farm 2,Basingstoke East 7 Renewables Ltd,Fleet 400kV Substation,FLEE4,,PRO-002739
Fleet Solar PV,FLEET SOLAR LIMITED,Fleet 400kV Substation,FLEE4,,PRO-002814
Fleet Tertiary,FLEET SOLAR LIMITED,Fleet 400kV Substation,FLEE4,,PRO-000429
Natpower Basingstoke Green Energy Park,NP SPV23 LIMITED,Fleet 400kV Substation,FLEE4,,PRO-003746
Patch Elm Solar Substation,VOLTIS PEOPLE LIMITED,Folly Farm 132kV Substation,,,PRO-002347
Forsa Energy Denny BESS,FORSA ENERGY GAS HOLDINGS LIMITED,FORSA ENERGY DENNY BESS 132KV GRID SUPPLY POINT SUBSTATION,DENN1,,PRO-004971
Fort Augustus BESS,FIELD DEVCO LTD,Fort Augustus GSP,FAUG1,,PRO-004599
Glendoe,SSE GENERATION LIMITED,Fort Augustus GSP,FAUG1,,PRO-000081
Millennium East,RENANTIS UK LIMITED,Fort Augustus GSP/New Fort Augustus GSP,FAUG1,,PRO-004010
Foyers,SSE GENERATION LIMITED,Foyers 275kV Substation,FOYE2,,PRO-000080
Lime Tree Energy Park,BNRG LANGMEAD LIMITED,Friston 400kV Substation,FRIS4,,PRO-004121
Clifton Lane BESS,RENEWABLES NORTH WEST LTD,Frodsham 132kV,FROD1,,PRO-003842
Frodsham Solar Park,Frodsham Solar Limited,Frodsham 132kV,FROD1,,PRO-001952
Clean Planet Solar,Clean Planet Solar Farm Limited,Frodsham 400kV Substation,FROD4,,PRO-003519
Weaver BESS,EXACT POWER LTD,Frodsham 400kV Substation,FROD4,,PRO-002571
Banc y Celyn Energy Park,Wind 2 Project 2 Limited,Future Swansea North 132kV,SWAN1,,PRO-002011
Fyrish Battery Storage,FIELD DEVCO LTD,Fyrish 132kV Substation,FYRI1,,PRO-004515
Scotsburn Road,TBC 002 LIMITED,Fyrish 275kV Substation,FYRI2,,PRO-002376
Greater Gabbard Offshore Wind Farm,GREATER GABBARD OFFSHORE WINDS LIMITED,Gabbard 33/132kV Offshore Substation,LEIS1,,PRO-000168
Lightsource Threepwood,LIGHTSOURCE RENEWABLE UK DEVELOPMENT LIMITED,Gala North 400/132kV Substation,GALN1,,PRO-004168
Longcroft Energy Park,Renewable Energy Systems Limited,Gala North 400/132kV Substation,GALN1,,PRO-002623
Leithenwater Wind Farm,LEITHENWATER WIND ENERGY HUB LIMITED,Galashiels 132/33kV,GALA3,,PRO-001914
Galawhistle Wind Farm,GALAWHISTLE WIND FARM LIMITED,Galawhistle 132/33kV Substation,GAWH3,,PRO-000161
Galloper Wind Farm,GALLOPER WIND FARM LIMITED,Galloper North 132/33kV Substation,LEIS1,,PRO-000162
Garn Fach Wind Farm,EDF ENERGY RENEWABLES LIMITED,Garn Fach 132kV Substation,,,PRO-001157
Garvary Wind Farm,GARVARY WIND FARM LTD,Garvary 132kV Substation,BEAU1,Y,PRO-001927
Gatroben Offshore Wind Farm,GATROBEN OFFSHORE DEVELOPMENTS 2 LIMITED,Gatroben Offshore Substation,,,PRO-001675
Glasgow Road 40MW BESS,GPC 1137 Ltd,Giffnock 275/33kV,GIFF3,,PRO-003566
Rigifa BESS,FIELD DEVCO LTD,Gills Bay 132kV,GILB1,,PRO-002758
MeyGen Tidal,MEYGEN PLC,Gills Bay GSP,GILB1,,PRO-000336-1
MeyGen Tidal,MEYGEN PLC,Gills Bay GSP,GILB1,,PRO-000336-2
MeyGen Tidal,MEYGEN PLC,Gills Bay GSP,GILB1,,PRO-000336-3
MeyGen Tidal,MEYGEN PLC,Gills Bay GSP,GILB1,,PRO-000336-4
MeyGen Tidal,MEYGEN PLC,Gills Bay GSP,GILB1,,PRO-000336-5
Glen App Windfarm,SCOTTISHPOWER RENEWABLES (UK) LIMITED,Glen App 33kV,GLAP3,,PRO-000063
Glen Kyllachy Wind Farm,GLEN KYLLACHY WIND FARM LIMITED,Glen Kyllachy Wind Farm Substation,GLKO1,,PRO-000165
Glen Lednock,Glen Lednock Wind Farm Limited,Glen Lednock 132kV Substation,,,PRO-004520
Glen Ullinish Wind Farm,GLEN ULLINISH WF LIMITED,Glen Ullinish 132/33kV Substation,GLNU3,,PRO-000298
Glen Ullinish Extension,GLEN ULLINISH WF 2 LTD,Glen Ullinish Extension 132/33kV Substation,GLUE1,,PRO-001346
Glendye Wind Farm,GLENDYE WIND FARM LIMITED,Glendye Wind Farm Substation,GLDY1,,PRO-001389
Rowancraig Wind Farm,Koehler Renewable Energy UK Limited,Glenglass 132/33kV,GLGL3,,PRO-002455
Twentyshilling Wind Farm,TWENTYSHILLING LIMITED,Glenglass 132/33kV,GLGL3,,PRO-001365
Whiteside Hill Wind Farm,WHITESIDE HILL WINDFARM (SCOTLAND) LIMITED,Glenglass 132/33kV,GLGL3,,PRO-000267
Minnygryle Burn Energy Park,Wind 2 Project 6 Limited,Glenlee 132/11kV,GLLE5,,PRO-004204
Narie,Invenergy Development UK Ltd,Glenlee 132/11kV,GLLE5,,PRO-004048
Glenchamber Wind Farm,GLENCHAMBER WIND ENERGY LIMITED,Glenluce 132/33kV,GLLU3,,PRO-000043
Craig Nab Wind Energy Hub,Craig Nab Wind Energy Hub Limited,Glenluce 132/33kV Substation,GLLU3,,PRO-002450
Glenmoriston (part of the Moriston Cascade),SSE GENERATION LIMITED,Glenmoriston GSP,GLEN5,,PRO-000083
Livishie (part of the Moriston Cascade),SSE GENERATION LIMITED,Glenmoriston GSP,GLEN5,,PRO-000173
Glenmuckloch Pumped Storage,GLENMUCKLOCH PUMPED STORAGE HYDRO LIMITED,Glenmuckloch 132/33kV,GLMU3,,PRO-000299
Glenmuckloch Wind Farm,GLENMUCKLOCH RENEWABLE ENERGY LIMITED,Glenmuckloch 132/33kV,GLMU3,,PRO-000300
Lagrae Battery Storage,LAGRAE BATTERY STORAGE LIMITED,Glenmuckloch 132kV Substation,GLMU3,,PRO-004214
Glenmuir Windfarm,BROCKWELL ENERGY LIMITED,Glenmuir Windfarm 132kV Substation,,,PRO-004058
Field Glenniston BESS,FIELD DEVCO LTD,Glenniston GSP,GLNI3,,PRO-004754
Kirkcaldy BESS,Apatura Battery Ltd,Glenniston GSP,GLNI3,,PRO-003743
Little Raith BES,DAISY NO 2 LIMITED,Glenniston GSP,GLNI3,,PRO-000887
Glenrothes BESS,GLENROTHES BESS LTD,Glenrothes 275/33kV,GLRO3,,PRO-002089
Markinch (Rothes) Biomass CHP Plant,RWE MARKINCH LIMITED,Glenrothes GSP,GLRO3,,PRO-000126
Roaring Hill Energy Storage Facility,ROARING HILL ENERGY STORAGE LTD,Glenrothes GSP,GLRO3,,PRO-001272
Glentaggart 42MW BESS,GLENTAGGART WIND LIMITED,Glentaggart WF 33kV Substation,REDS3,,PRO-001595
Gordonbush Wind Farm,SSE GENERATION LIMITED,Gordonbush GSP,GORW3,,PRO-000518
StrataStore - Cheshire Energy Storage Facility,KISTOS ENERGY STORAGE LTD,Gorstage 400kV Substation,,,PRO-003978
Helen Street BESS,Vital Energi Solutions Limited,Govan 132/33kV,GOVA3,,PRO-003168
Grain,UNIPER UK LIMITED,Grain 400kV Substation,GRAI4,,PRO-000049
Medway Power Station,MEDWAY POWER LIMITED,Grain 400kV Substation,GRAI4,,PRO-000203
Grain North Power Station,GRAIN NORTH POWER LIMITED,Grain North 132kV Substation,GRAI1,,PRO-001524
Grain South Power Station,Grain South Power Limited,Grain South 132kV Substation,GRAI1,,PRO-000449
EcoGrainWest,Econergy International Limited,Grain West 400kV Substation,GRAW4,,PRO-002223
Grangemouth  Hybrid BESS & Solar PV,TAGENERGY DEVELOPMENT UK LIMITED,Grangemouth 275/33kV,GRMO3,,PRO-003254
Grangemouth CHP,GRANGEMOUTH CHP LIMITED,Grangemouth Ineos GSP,GRMO3,,PRO-001283
Greenburn Mixed Technology,REG GREENBURN LIMITED,Greenburn Mixed Technology 132kV Substation,,,PRO-001006
Greenock Road BESS,Pulse Clean Energy Limited,Greenock Road 275kV Substation,ERSK3,Y,PRO-004761
Gammidge PV & BESS Park,CS UK HOLDINGS III LIMITED,Grendon 132kV Substation,GREN1,,PRO-001649
Grendon High Impact Green Energy Hub (HIGEH) 1,TELIS ENERGY UK LIMITED,Grendon 400kV Substation,GREN4,,PRO-002651
Grendon Solar & BESS,Green Hill Solar Farm Limited,Grendon 400kV Substation,GREN4,,PRO-001568
NatPower Kinoulton Green Energy Park,NP SPV32 LIMITED,Grendon 400kV Substation,GREN4,,PRO-004333
Bendle Farm,Balance Power Projects Limited,Gretna 400/132kV,GRNA1,,PRO-002243
Bendsmoor BESS,Apatura Battery Ltd,Gretna 400/132kV,GRNA1,,PRO-003582
Gresham House Gretna BESS,ALBUSIA LTD,Gretna 400/132kV,GRNA1,,PRO-002367
Gretna Synchronous Compensation,GRETNA GRID SERVICES LIMITED,Gretna 400/132kV,GRNA1,,PRO-001444
GH DEVCO Gretna Green BESS,Gresham House Devco Pipeline Limited,Gretna Green 132 kV Substation,GRNA1,Y,PRO-003096
Tinnisburn Wind Farm,BAYWA R.E. UK LIMITED,Gretna Green 132 kV Substation,GRNA1,Y,PRO-003997
Tees CCPP,SEMBCORP UTILITIES (UK) LIMITED,Greystones A and B 275kV Substations,GRSA2,,PRO-001048-1
Tees CCPP,SEMBCORP UTILITIES (UK) LIMITED,Greystones A and B 275kV Substations,GRSA2,,PRO-001048-2
Tees CCPP,SEMBCORP UTILITIES (UK) LIMITED,Greystones A and B 275kV Substations,GRSA2,,PRO-001048-3
Tees CCPP,SEMBCORP UTILITIES (UK) LIMITED,Greystones A and B 275kV Substations,GRSA2,,PRO-001048-4
Tees CCPP,SEMBCORP UTILITIES (UK) LIMITED,Greystones A and B 275kV Substations,GRSA2,,PRO-001048-5
Tees CCPP,SEMBCORP UTILITIES (UK) LIMITED,Greystones A and B 275kV Substations,GRSA2,,PRO-001048-6
Griffin Wind Farm,GRIFFIN WIND FARM LIMITED,Griffin 132/33kV Substation,GRIF3,,PRO-000169
Bute Hydrogen Project 3,BUTE HYDROGEN PROJECT 3 LIMITED,Grimsby West 400kV Substation,GRIW4,,PRO-004126
Carbon Free 2030,CARBON FREE 2030 ENERGY LIMITED,Grimsby West 400kV Substation,GRIW4,,PRO-003047
EcoGrimsbyWest,Econergy International Limited,Grimsby West 400kV Substation,GRIW4,,PRO-002251
Grimsby BESS,Shama BESS Limited,Grimsby West 400kV Substation,GRIW4,,PRO-002633
STALLINGBOROUGH CARBON CAPTURE CCGT,RWE STALLINGBOROUGH LIMITED,Grimsby West 400kV Substation,GRIW4,,PRO-003867
Stallingborough PV & BESS Station,IGP INTERNATIONAL PROSPECTING LIMITED,Grimsby West 400kV Substation,GRIW4,,PRO-003021
Butt Lane - Grimsby BESS,Bluestone Energy Ltd,Grimsby West GSP,GRIW1,,PRO-004491
