Project Name,Customer Name,Connection Site,Node_Name,Node Assumed,Project Number
Fearna PSH 2,FEARNA PSH LIMITED,Loch Fearna Pumped Storage 275kV,,,PRO-004391
Loch Kemp PSH Phase 2,STATERA ENERGY LIMITED,Loch Kemp 275kV substation,,,PRO-002285
Loch Kemp Pumped Storage,LOCH KEMP STORAGE LIMITED,Loch Kemp 275kV substation,,,PRO-001559
Loch Liath Wind Farm,LOCH LIATH WIND FARM LIMITED,Loch Liath 132/33kV Substation,,,PRO-001671
Loch Luichart Extension II,BLUEBELL WIND FARM LIMITED,Loch Luichart Extension II Substation,,,PRO-000487
Loch nan Eun PSH,GLENDOE STORAGE LIMITED,Loch Nan Eun 275/18kV,,,PRO-002063
Lochay (Part of Killin Cascade Hydro Scheme),SSE GENERATION LIMITED,Lochay GSP,LOCH5,,PRO-000174
Lochay (Part of Killin Cascade Hydro Scheme),SSE GENERATION LIMITED,Lochay GSP,LOCH5,,PRO-000174
London Array Offshore Wind Farm,LONDON ARRAY LIMITED,London Array 33/150kV Offshore Substations,CLEH4,,PRO-000201
Rye House,RYE HOUSE 10 RENEWABLES LIMITED,London North East Connection Node A,,,PRO-003413
Amersham Main,Amersham 10 Renewables Limited,London North West Connection Node A 400kV Substation,,,PRO-003404
Beddington 1 BESS,Bluestone Energy Ltd,London South Connection Node A 132kV Substation,,,PRO-003170
Tyler Hill Iver,FRV TH Powertek Limited,London West Connection Node A 400kV Substation,,,PRO-004134
TH West Weybridge,FRV TH Powertek Limited,London West Connection Node B 400kV Substation,,,PRO-003531
West Weybridge,West Weybridge 10 Renewables Limited,London West Connection Node B 400kV Substation,,,PRO-003410
Long Stratton PV & BESS Station,IGP INTERNATIONAL PROSPECTING LIMITED,Long Stratton 400kV,,,PRO-002297
Alcemi Devilla Battery Energy Storage Facility,ALCEMI STORAGE DEVELOPMENTS 3 LIMITED,Longannet 275kV,LOAN2,,PRO-001453
Lorg Extension Wind Farm,RWE RENEWABLES UK ONSHORE WIND LIMITED,Lorg Wind Farm 132/32kV,LORG3,,PRO-002430
Lorg Wind Farm,RWE RENEWABLES UK ONSHORE WIND LIMITED,Lorg Wind Farm 132/32kV,LORG3,,PRO-000153
Peak Gen Havant,PEAK GEN POWER 18 LIMITED,Lovedean 132KV Substation,LOVE1,,PRO-003903
EcoLovedean,Econergy International Limited,Lovedean 400kV Substation,LOVE4,,PRO-002230
Green Frog @ Down Barn Farm,VIRIDIS 178 LIMITED,Lovedean 400kV Substation,LOVE4,,PRO-001261
Lovedean (Tertiary),LOVEDEAN GREEN LIMITED,Lovedean 400kV Substation,LOVE4,,PRO-000484-1
Lovedean (Tertiary),LOVEDEAN GREEN LIMITED,Lovedean 400kV Substation,LOVE4,,PRO-000484-2
Lovedean Greener Grid Park,STATKRAFT UK LTD,Lovedean 400kV Substation,LOVE4,,PRO-001855
Luichart (part of the Conon Cascade),SSE GENERATION LIMITED,Luichart GSP,LUIC5,,PRO-000175
Montreathmont Moor Forest,Montreathmont Energy Centre Limited,Lunanhead GSP,LUNA1,,PRO-001849
Templeton BESS,Fig Power Limited,Lyndhurst 132/33kV,LYND1,,PRO-002593-1
Templeton BESS,Fig Power Limited,Lyndhurst 132/33kV,LYND1,,PRO-002593-2
Galileo 05,Galileo Empower UK Limited,Lynemore Windfarm 132kV Substation,,,PRO-004173
Bellrock Offshore Wind Farm,BLUEFLOAT ENERGY UK HOLDINGS LIMITED,Lyra 320/66kV Offshore Substation,,,PRO-001496
M74 West Wind Farm,RENEWCO POWER LIMITED,M74 West Wind Farm 132kV,,,PRO-002398
EcoMablethorpe,Econergy International Limited,Mablethorpe 400kV Substation,MABL4,,PRO-002583
Mablethorpe Green Energy Centre,MABLETHORPE GREEN ENERGY CENTRE LIMITED,Mablethorpe 400kV Substation,MABL4,,PRO-002255
Mablethorpe Storage,STATERA ENERGY LIMITED,Mablethorpe 400kV Substation,MABL4,,PRO-001979
Machair Offshore Wind Farm,SCOTTISHPOWER RENEWABLES (UK) LIMITED,Machair 275/66kV Offshore Substation,,,PRO-001392
Maentwrog,NUCLEAR DECOMMISSIONING AUTHORITY,Maentwrog GSP,,,PRO-000261
Daines NP BESS,NORIKER POWER LTD,Manchester South connection node A 400kv,,,PRO-003194
Cellarhead PV & BESS Station,IB VOGT UK LTD,Manchester South Connection Node B 400kV Substation,,,PRO-003240
Mannington,BAYWA R.E. UK LIMITED,Mannington 400kV Substation,MANN4,,PRO-001092
Mannington,PIVOTED POWER LLP,Mannington 400kV Substation,MANN4,,PRO-001091
Mannington Tertiary,MANNINGTON ENERGY CENTRE LIMITED,Mannington 400kV Substation,MANN4,,PRO-000464
Manquhill Wind Farm,ENERGYFARM UK MANQUHILL LTD,Manquhill Wind Farm 132/33kV Substation,,,PRO-004662
Marchwood,MARCHWOOD POWER LIMITED,Marchwood 400kV Substation,MAWO4,,PRO-000202
MARCHWOOD ENERGY STORAGE,BW ESS DEVELOPMENT UK LIMITED,Marchwood 400kV Substation,MAWO4,,PRO-002190
Y Bryn Wind Farm,Y BRYN WIND FARM LIMITED,Margam 275kV Substation,MAGA2,,PRO-002029
Knockodhar Wind Farm,REG KNOCKODHAR LIMITED,Mark Hill 275/132kV,MAHI1,,PRO-000483
Mark Hill Wind Farm,SCOTTISHPOWER RENEWABLES (UK) LIMITED,Mark Hill 275/132kV,MAHI1,,PRO-000066
Whiteminhill Renewable Energy Park,VOLTALIA UK LTD,Mark Hill 275/33kV,MAHI1,,PRO-003693
Braybrooke,SSE DE SOLAR HOLDCO LIMITED,Market Harborough 400kV Substation,MARH4,,PRO-003429
ER MKH Energy,ER PROJECT DEVELOPMENT CO LIMITED,Market Harborough 400kV Substation,MARH4,,PRO-002621
Market Harborough GEC (Ethos Green),MARKET HARBOROUGH GREEN ENERGY CENTRE LTD,Market Harborough 400kV Substation,MARH4,,PRO-004343
Market Harborough Green Energy Hub,TELIS ENERGY UK LIMITED,Market Harborough 400kV Substation,MARH4,,PRO-003623
Lightsource Marston Vale 240MW PV+BESS,LIGHTSOURCE RENEWABLE UK DEVELOPMENT LIMITED,Marston Vale 400kV Substation,MILL4,,PRO-003981
Marston Farm 2,548 UK INVESTMENT HOLDINGS LIMITED,Marston Vale 400kV Substation,MILL4,,PRO-002740
Millbrook Power,MILLBROOK POWER LIMITED,Marston Vale 400kV Substation,MILL4,,PRO-000373
Assel Valley Wind Farm,ASSEL VALLEY WIND ENERGY LIMITED,Maybole 132/33kV,MAYB3,,PRO-000014
Craiginmoddie Wind Farm,ENERGYFARM UK CRAIGINMODDIE LLP,Maybole 132/33kV,MAYB3,,PRO-003829
Hadyard Hill,SSE RENEWABLES WIND FARMS (UK) LIMITED,Maybole 132/33kV,MAYB3,,PRO-000170
Assel Valley Extension Wind Farm,RENANTIS UK LIMITED,Maybole GSP,MAYB3,,PRO-002632-1
Assel Valley Extension Wind Farm,RENANTIS UK LIMITED,Maybole GSP,MAYB3,,PRO-002632-2
Kirk Hill,KIRK HILL WIND FARM LIMITED,Maybole GSP,MAYB3,,PRO-000320
Caledonian Paper Mill (Meadowhead),UPM-KYMMENE (UK) LIMITED,Meadowhead GSP,MEAD1,,PRO-001308
Beanacre BESS,Grenergy Renewables UK Limited,Melksham 132kV Substation,MELK1,,PRO-002452
JBM Solar 13 - Melksham,JBM SOLAR PROJECTS 13 LIMITED,Melksham 400kV Substation,MELK4,,PRO-000495
Melksham,LIME DOWN SOLAR PARK LIMITED,Melksham 400kV Substation,MELK4,,PRO-001605
Melksham  (Tertiary),MELKSHAM CALNE GREEN LIMITED,Melksham 400kV Substation,MELK4,,PRO-000463-1
Melksham  (Tertiary),MELKSHAM CALNE GREEN LIMITED,Melksham 400kV Substation,MELK4,,PRO-000463-2
Melksham BESS & PV,ELEMENTS GREEN LIMITED,Melksham 400kV Substation,MELK4,,PRO-002441
Melksham Grid Park ESS & PV,JEPIPHANY LIMITED,Melksham 400kV Substation,MELK4,,PRO-004164
Melkshem (Cartridge Farm),Queequeg Renewables Ltd,Melksham 400kV Substation,MELK4,,PRO-003193
Norrington Gate,ADV 004 LIMITED,Melksham 400kV Substation,MELK4,,PRO-002329
South Brook,DALIA HOLDINGS LTD,Melksham 400kV Substation,MELK4,,PRO-002402
Gastard BESS,SIRIUSECODEV (GASTARD) LTD,Melksham B 132KV Substation,MELK1,,PRO-003552
Melvich Wind Energy Hub,Melvich Wind Energy Hub Limited,Melvich Community Wind Farm 132/33kV Substation,,,PRO-001688
Lightsource Berthlwyd,LIGHTSOURCE RENEWABLE UK DEVELOPMENT LIMITED,Mid Wales Connection Node A,,,PRO-004858
Carnedd Wen Wind Farm,Npower Renewables Ltd,Mid Wales West 132kV Substation,,,PRO-000090
Middle Muir Wind Farm,OnPath Energy Limited (MIDDLE MUIR WIND FARM) LIMITED,Middlemuir 132/33kV,MIDM3,,PRO-000321
Kennoxhead Wind Farm Extension,KENNOXHEAD WIND FARM LIMITED,Middlemuir Wind Farm Collector Substation,MIDM1,,PRO-000482
Lightsource Middleton,LIGHTSOURCE RENEWABLE UK DEVELOPMENT LIMITED,Middleton 400KV Substation,MIDL4,,PRO-004817
Middleton BESS,Middleton Energy Storage Limited,Middleton 400KV Substation,MIDL4,,PRO-002305
Mill Hill Tertiary Connection,HB333MIL LTD,Mill Hill 275kV Substation,MILH2,,PRO-000493
Millennium Wind,MILLENNIUM WIND ENERGY LIMITED,Millennium GSP,MILW3,,PRO-000530
Milligansbush Battery Storage,Milligansbush Battery Storage Ltd,Milligansbush Battery Storage 132kV Substation,,,PRO-003430
Pitkerro Road,Vital Energi Solutions Limited,Milton of Craigie GSP,MILC3,,PRO-002457
Dog Trap Lane,HD381GRE Limited,Minety 400kV Substation,MITY4,,PRO-001626
Fairholme BESS,HB411MIN Limited,Minety 400kV Substation,MITY4,,PRO-001625
Minety,HB411MIN Limited,Minety 400kV Substation,MITY4,,PRO-000454
Pond Hill Farm 1,PD688IRO LTD,Minety 400kV Substation,MITY4,,PRO-001637
Pond Hill Farm 2 BESS,PD688IRO LTD,Minety 400kV Substation,MITY4,,PRO-001635
Somerford,PD813ETY LTD,Minety 400kV Substation,MITY4,,PRO-001631
Southfields,PD503HAN LTD,Minety 400kV Substation,MITY4,,PRO-001632
Southfields Farm,PD300RON Ltd,Minety 400kV Substation,MITY4,,PRO-001852
Conrad (Swindon) Limited,CONRAD (SWINDON) LIMITED,Minety GSP,MITY1,,PRO-004385
Minety Tertiary (2),JBM SOLAR PROJECTS 14 LTD,Minety GSP,MITY1,,PRO-000432
Minnygap,MINNYGAP ENERGY LIMITED,Moffat 132/33kV,MOFF3,,PRO-000262
Moffat BESS,Conrad Energy (Developments) II Limited,Moffat 400/132kV,MOFF1,,PRO-004654
Kingfisher Farm,REWE 6 LIMITED,Monk Fryston 275kV Substation,MONF2,,PRO-002555
Monk Fryston,Downing Renewable Developments LLP,Monk Fryston 275kV Substation,MONF2,,PRO-003400
Monk Fryston,Light Valley Solar Limited,Monk Fryston 275kV Substation,MONF2,,PRO-001646
Monk Fryston BESS,HARMONY ENERGY LIMITED,Monk Fryston 275kV Substation,MONF2,,PRO-001619
Monk Fryston SSE,SSE BATTERY MONK FRYSTON LIMITED,Monk Fryston 275kV Substation,MONF2,,PRO-001627
Monk Fryston Tertiary Connection,HD777FRY LTD,Monk Fryston 275kV Substation,MONF2,,PRO-000479
Monk Fryston,ENSO GREEN HOLDINGS LIMITED,Monk Fryston 400kV Substation,MONF4,,PRO-002159
Monk Fryston Energy Park,ELEMENTS GREEN DEVELOPMENT LTD,Monk Fryston 400kV Substation,MONF4,,PRO-002539
Monquhill Wind Farm,RWE RENEWABLES UK ONSHORE WIND LIMITED,Monquhill Wind Farm 132kV/33kV,MONQ3,,PRO-000478
Moray West Offshore Windfarm,MORAY OFFSHORE WINDFARM (WEST) LIMITED,Moray Firth 220/33kV Platform 1 & 2 Offshore Substation,MOWO4,,PRO-001130-1
Moray West Offshore Windfarm,MORAY OFFSHORE WINDFARM (WEST) LIMITED,Moray Firth 220/33kV Platform 1 & 2 Offshore Substation,MOWO4,,PRO-001130-2
Mossford (part of the Conon Cascade),SSE GENERATION LIMITED,Mossford GSP,MOSS1,,PRO-000176
EcoMossmorran,Econergy International Limited,Mossmorran 132/33kV,MOSM3,,PRO-003469
Gresham House Mossmoran BESS,Gresham House Devco Pipeline Limited,Mossmorran 132/33kV,MOSM3,,PRO-002395
Mossmorran Storage BESS,RUFUSIA LTD,Mossmorran 132/33kV,MOSM3,,PRO-003738
Mossy Hill Wind Farm,MOSSY HILL SHETLAND LIMITED,Mossy Hill 132kV Substation,MSHL3,,PRO-000461
Muaitheabhal Wind Farm,UISENIS POWER LIMITED,Muaitheabhal 132/33kV Substation,,,PRO-000272
MCKRAW99MW BESS BEGA,SMS ENERGY SERVICES LIMITED,Muckraw IDNO GSP,,,PRO-004272
Burn of Whilk Wind Farm,ENECO BURN OF WHILK LIMITED,Mybster 1 GSP,MYBS3,,PRO-000087
Cogle Moss Wind Farm,COGLE MOSS RENEWABLES LLP,Mybster 2 132/33kV Substation,MYBS3,,PRO-000973
Lisa's Battery Storage,POTENCIA ENERGY LIMITED,Mybster 3 132/33kV Substation,MYBS3,,PRO-003280
Mybster 2 Battery Storage,POTENCIA ENERGY LIMITED,Mybster 3 132/33kV Substation,MYBS3,,PRO-004479
Tormsdale Windfarm,ASUK HOLDCO 1 LIMITED,Mybster 3 132/33kV Substation,MYBS3,,PRO-001904
Bad a Cheo Wind Farm,RWE RENEWABLES UK SWINDON LIMITED,Mybster 3 33kV Substation,MYBS3,,PRO-000018
Halsary Wind Farm,SCOTTISHPOWER RENEWABLES (UK) LIMITED,Mybster 3 33kV Substation,MYBS3,,PRO-000189
Watten Wind Farm,EDF ENERGY RENEWABLES LIMITED,Mybster 3 GSP,MYBS3,,PRO-001928
Newton of Park BESS 2,OPDE UK LIMITED,Nairn GSP,NAIR1,,PRO-003562
Nant,SSE GENERATION LIMITED,Nant 132kV Substation,NANT1,,PRO-000177
Nant Y Maen Wind Farm,EDF ENERGY RENEWABLES LIMITED,Nant Y Maen 132KV Substation,,,PRO-001158
NatPower CoalBurn Green Energy Park,COALBURN ENERGY LIMITED,NatPower Green Energy Park 400kV Substation,,,PRO-005041
Bicker Drove,REWE 1 LIMITED,Navenby 400kV Substation,BICF4,Y,PRO-003874
Cliff Hill Energy Farm,Renewable Energy Systems Limited,Navenby 400kV Substation,BICF4,Y,PRO-003896
Cranwell Solar & BESS Farm,TRIO POWER LIMITED,Navenby 400kV Substation,BICF4,Y,PRO-004952
Ewerby,SSE EWERBY SOLAR LIMITED,Navenby 400kV Substation,BICF4,Y,PRO-002017
Housham PV & BESS,FOSSE GREEN ENERGY LIMITED,Navenby 400kV Substation,BICF4,Y,PRO-002254
Leadenham High Impact Green Energy Hub,TELIS ENERGY UK LIMITED,Navenby 400kV Substation,BICF4,Y,PRO-003815
NatPower Navenby Energy Park,NAVENBY ENERGY LIMITED,Navenby 400kV Substation,BICF4,Y,PRO-005006
Navenby GEC (Ethos Green),NAVENBY GREEN ENERGY CENTRE LTD,Navenby 400kV Substation,BICF4,Y,PRO-003936
Springwell,SPRINGWELL ENERGYFARM LIMITED,Navenby 400kV Substation,BICF4,Y,PRO-001850-1
Springwell,SPRINGWELL ENERGYFARM LIMITED,Navenby 400kV Substation,BICF4,Y,PRO-001850-2
Neart Na Gaoithe Offshore Wind Farm,NEART NA GAOITHE OFFSHORE WIND LIMITED,Neart Na Gaoithe 220/66KV Offshore Substation,CRYR4,,PRO-000273
Perry Barr BESS,Perry Barr Limited,Nechells East GSP,NECH1,,PRO-004745
Bradenham - Thetford (Necton) GEC (Ethos Green),NECTON GREEN ENERGY CENTRE LTD,Necton 400kV Substation,NECT4,,PRO-004346
Dudgeon Offshore Wind Farm,DUDGEON OFFSHORE WIND LIMITED,Necton 400kV Substation,NECT4,,PRO-000132
J212 High Grove Solar,RWE RENEWABLES UK SOLAR AND STORAGE LIMITED,Necton 400kV Substation,NECT4,,PRO-002542
Necton Greener Grid Park,Necton Grid Solutions Limited,Necton 400kV Substation,NECT4,,PRO-002562-1
Necton Greener Grid Park,Necton Grid Solutions Limited,Necton 400kV Substation,NECT4,,PRO-002562-2
Norfolk Boreas,NORFOLK BOREAS LIMITED,Necton 400kV Substation,NECT4,,PRO-000399-1
Norfolk Boreas,NORFOLK BOREAS LIMITED,Necton 400kV Substation,NECT4,,PRO-000399-2
Vanguard,NORFOLK VANGUARD WEST LIMITED,Necton 400kV Substation,NECT4,,PRO-000459
Vanguard East,Norfolk Vanguard East Ltd,Necton 400kV Substation,NECT4,,PRO-000580-1
Vanguard East,Norfolk Vanguard East Ltd,Necton 400kV Substation,NECT4,,PRO-000580-2
Zenobe Necton BESS,ZENOBE ENERGY LIMITED,Necton 400kV Substation,NECT4,,PRO-003402
Glennifer Road BESS,GPC 1119 Ltd,Neilston 400/275/132kV,NEIL1,,PRO-003600
Neilston 132kV Greener Grid Park,Neilston Energy Limited,Neilston 400/275/132kV,NEIL1,,PRO-001343-1
Neilston 132kV Greener Grid Park,Neilston Energy Limited,Neilston 400/275/132kV,NEIL1,,PRO-001343-2
Middleton Farm BESS,Bluestone Energy Ltd,Neilston 400kV Substation,NEIL4,,PRO-004120
Neilston 400kV Greener Grid Park,STATKRAFT UK LTD,Neilston 400kV Substation,NEIL4,,PRO-001419
Neilston Synchronous Compensation,NEILSTON GRID SERVICES LIMITED,Neilston 400kV Substation,NEIL4,,PRO-001405
Nethercourt Solar & BESS Farm,GREENTECH PROJECTS HOLDING UK LIMITED,Nethercourt Substation,,,PRO-003437
Netherton Hub Bess,FIELD DEVCO LTD,Netherton 400kV Substation,NETH3,,PRO-004753
Breezy Hill Wind Farm,BROCKWELL ENERGY LIMITED,New Cumnock 275/132kV,NECU1,,PRO-000475
North Kyle New Cumnock,NORTH KYLE WIND FARM LIMITED,New Cumnock 275/132kV,NECU1,,PRO-000474
South Kyle Wind Farm,SOUTH KYLE WIND FARM LIMITED,New Cumnock 275/132kV,NECU1,,PRO-000137
Chalmerston Windfarm,BROCKWELL ENERGY LIMITED,New Cumnock 275/132kV Substation,NECU1,,PRO-004057
New Cumnock BESS,NEW CUMNOCK BESS LTD,New Cumnock 275/132kV Substation,NECU1,,PRO-003485
Upper Beoch Windfarm,BROCKWELL ENERGY LIMITED,New Cumnock 275/132kV Substation,NECU1,,PRO-004068
L48 BESS Burnside,Lower 48 Energy BESS Limited,New Deer 2 132kV Substation,NEDE1,,PRO-003063
[23-0225] UPPER GREENFIELDS - 175MW BESS,Lower 48 Energy BESS Limited,New Deer 2 400kV Substation,NEDE4,,PRO-003682
Bowdun (ex Cluaran Deas Ear) Offshore Wind Farm,BOWDUN OFFSHORE WIND FARM LIMITED,New Deer 2 400kV Substation,NEDE4,,PRO-002091
Broadshore Offshore Wind Farm,BLUEFLOAT ENERGY UK HOLDINGS LIMITED,New Deer 2 400kV Substation,NEDE4,,PRO-002171
New Deer 2 BESS,FIELD DEVCO LTD,New Deer 2 400kV Substation,NEDE4,,PRO-004758
New Deer BESS Station,IGP SOLAR 25 LIMITED,New Deer 2 400kV Substation,NEDE4,,PRO-001856
North East Offshore Wind Farm,CALEDONIA OFFSHORE WIND FARM LIMITED,New Deer 2 400kV Substation,NEDE4,,PRO-001436
Peterhead PV and BESS Station,ETP UK 2 LTD,New Deer 2 400kV Substation,NEDE4,,PRO-002775
Green Volt Offshore Windfarm,FLOTATION ENERGY LIMITED,New Deer 400kV Substation,NEDE4,,PRO-001469
Moray East Offshore Wind Farm,MORAY OFFSHORE WINDFARM (EAST) LIMITED,New Deer 400kV Substation,NEDE4,,PRO-000533
New Deer Battery Storage,WEAVER POWER LIMITED,New Deer 400kV Substation,NEDE4,,PRO-001987
Zenobe New Deer Battery Storage,ZENOBE ENERGY LIMITED,New Deer 400kV Substation,NEDE4,,PRO-001778
Magwind,MAGNORA OFFSHORE WIND AS,New Dounreay,DOUN1,Y,PRO-001766
Dounreay BESS,FIELD DEVCO LTD,New Dounreay 400kV substation,DOUN4,Y,PRO-004749
New Marton GEC,NEW MARTON GREEN ENERGY CENTRE LIMITED,New Marton 400kV Substation,,,PRO-004796
Ardonald Wind Farm,Ardonald Renewables Limited,New North East 275kV Substation,,,PRO-003491
Daventry High Impact Green Energy Hub (HIGEH) 1,TELIS ENERGY UK LIMITED,New Patford Bridge 400kV Substation,PAFB4,Y,PRO-003686
Patford Bridge Farm 2,548 UK INVESTMENT HOLDINGS LIMITED,New Patford Bridge 400kV Substation,PAFB4,Y,PRO-002741
Jackdaw BESS,Downing Renewable Developments LLP,New Stutton LILO 275kV Substation,,,PRO-004351
Greenside BESS,Apatura Battery Ltd,Newarthill Energy Park 275kV Substation,NEAR2,,PRO-003579
Newarthill Energy Park,Geocore (Newarthill) Ltd,Newarthill Energy Park 275kV Substation,NEAR2,,PRO-002532
Newchurch,SSE UTILITY SOLUTIONS LIMITED,Newchurch 400kV Substation,DUNG4,Y,PRO-002056
Newlands Hill Wind Energy Hub,NEWLANDS HILL WIND ENERGY HUB LIMITED,Newlands Hill 132/33kV,,,PRO-002549
Airies Wind Farm,AIRIES WINDFARM LIMITED,Newton Stewart 132/33kV,NEWS1,,PRO-000008
Artfield Forest Windfarm,ARTFIELD FOREST WIND FARM LTD,Newton Stewart GSP,NEWS1,,PRO-001310
Nicolton Road BESS,Apatura Battery Ltd,Nicolton Road 275kV Substation,,,PRO-003234
Catsfield,Battery Asset Management Limited,Ninfield 132kV/400kV,NINF4,,PRO-004143
Ninfield Green Energy Centre,NINFIELD GREEN ENERGY CENTRE LIMITED,Ninfield 400kV Substation,NINF4,,PRO-002163
Ninfield Greener Grid Park,STATKRAFT UK LTD,Ninfield 400kV Substation,NINF4,,PRO-001756-1
Ninfield Greener Grid Park,STATKRAFT UK LTD,Ninfield 400kV Substation,NINF4,,PRO-001756-2
Ninfield Greener Grid Park,STATKRAFT UK LTD,Ninfield 400kV Substation,NINF4,,PRO-001756-3
TH Ninfield,FRV TH Powertek Limited,Ninfield GSP,NINF1,,PRO-004111
North Lowther Energy Initiative,NLEI LTD,NLEI GSP,,,PRO-000344
Elmya Gissing BESS & PV,RPC ELMYA CARNATION DEVCO LIMITED,North Anglia Connection Node A 400kV,,,PRO-004657
Long Stratton 400,ENSO GREEN HOLDINGS X LIMITED,North Anglia Connection Node A 400kV,,,PRO-004868
Long Stratton BESS,FIELD DEVCO LTD,North Anglia Connection Node A 400kV,,,PRO-004850
Noventum -Long Stratton,Noventum Power Solar 8 Limited,North Anglia Connection Node A 400kV,,,PRO-004405
Greta IV (b),Greta IV Limited,North Anglia Connection Node B 400kV Substation,,,PRO-004499
Greta IV (c),Greta IV Limited,North Anglia Connection Node B 400kV Substation,,,PRO-004500
Greta IV (d),Greta IV Limited,North Anglia Connection Node B 400kV Substation,,,PRO-004501
Project Number 4,Greta IV Limited,North Anglia Connection Node B 400kV Substation,WALP4,,PRO-002704
NatPower Yaxley Green Energy Park,NP SPV 40 LIMITED,North Anglia Connection Node C 400kV Substation,,,PRO-004371
Scarning,CONNECTID 3 LIMITED,North Anglia Connection Node C 400kV Substation,,,PRO-003275
Walsoken Battery,Walsoken Limited,North Anglia Connection Node D 132kV Substation,WALP1,,PRO-002690
Dove Solar,RWE RENEWABLES UK SOLAR AND STORAGE LIMITED,North Anglia Connection Node E 400kV Substation,,,PRO-004166
EPL Suffolk,EPL NEWCO9 LIMITED,North Anglia Connection Node E 400kV Substation,NORM4,,PRO-003916
Lightsource Yaxley PV,LIGHTSOURCE RENEWABLE UK DEVELOPMENT LIMITED,North Anglia Connection Node E 400kV Substation,YAXL4,,PRO-003837
Noventum Yaxley,NOVENTUM POWER SOLAR 3 LIMITED,North Anglia Connection Node E 400kV Substation,YAXL4,,PRO-003758
Yaxley,CONNECTID 2 LIMITED,North Anglia Connection Node E 400kV Substation,YAXL4,,PRO-003272
Yaxley BESS,FIELD DEVCO LTD,North Anglia Connection Node E 400kV Substation,YAXL4,,PRO-003964
Zenobe Yaxley BESS,ZENOBE ENERGY LIMITED,North Anglia Connection Node E 400kV Substation,YAXL4,,PRO-004088
North Falls Offshore Wind Farm,NORTH FALLS OFFSHORE WIND FARM LIMITED,North Falls Offshore Platform Substation,,,PRO-000451
NEL Limes,Newton Energi Limited,North Humber Connection Node B 132kV Substation,,,PRO-004413
014 NEP Bransholme,NEW ENERGY PARTNERSHIP LIMITED,North Humber Connection Node C 132kV Substation,CREB4,Y,PRO-004043
Lightsource Overton,LIGHTSOURCE RENEWABLE UK DEVELOPMENT LIMITED,North Humber Connection Node E 400kV Substation,OVER2,,PRO-003958
Alcemi  Ridham Docks BESF,Alcemi Storage Developments 23 Ltd,North Kent Connection Node A 400kV Substation,KEMS4,,PRO-003211
Hurst BESS,FIRSTWAY SOLAR LTD,North Kent Connection Node C 400kV Substation,,,PRO-004388
Hurst BESS,LUMINOUS ENERGY GROUP LIMITED,North Kent Connection Node C 400kV Substation,,,PRO-004249
North Lanrigg Battery Storage,North Lanrigg Battery Storage Ltd,North Lanrigg Substation,,,PRO-002671
Foel Fach Wind Farm,FOEL FACH WIND FARM LIMITED,North Wales connection Node A 400kV Substation,,,PRO-004327
Gwynt Alwen WF,WIND 2 LIMITED,North Wales connection Node A 400kV Substation,TRAW1,,PRO-001545
NatPower Gwyddelwern Green Energy Park,NP SPV31 Limited,North Wales connection Node A 400kV Substation,,,PRO-004432
NorthFleet 2 BESS,CSE41 LIMITED,NorthFleet 400kV Substation,NFLE4,,PRO-002322
NorthFleet Tertiary,CSE29 LIMITED,NorthFleet 400kV Substation,NFLE4,,PRO-002038
Broadditch BESS,Harmony BD Ltd,Northfleet East 132kV,NFLE1,,PRO-002000
Hazells Farm,Northfleet Devco Limited,Northfleet East 400kV Substation,NFLE4,,PRO-003834
Norton PV and BESS,Darlington Solar 1 Limited,Norton 275kV Substation,NORT4,,PRO-001437
Al Boum Photo (Norton),AL BOUM PHOTO LTD,Norton 400kV Substation,NORT4,,PRO-001651
Bute Hydrogen Project 4,BUTE HYDROGEN PROJECT 4 LIMITED,Norton 400kV Substation,NORT4,,PRO-004127
Norton,BAYWA R.E. UK LIMITED,Norton 400kV Substation,NORT4,,PRO-001537
Norton,ENSO GREEN HOLDINGS LIMITED,Norton 400kV Substation,NORT4,,PRO-002157
Zenobe Norton,ZENOBE ENERGY LIMITED,Norton 400kV Substation,NORT4,,PRO-001691
Grindon Grange,STARLIGHT ENERGY UK LIMITED,Norton East 400kV Substation,NORT4,Y,PRO-004028
Letch Beck Energy Park,Renewable Energy Systems Limited,Norton East 400kV Substation,NORT4,Y,PRO-002550
Lightsource Norton East PV,LIGHTSOURCE RENEWABLE UK DEVELOPMENT LIMITED,Norton East 400kV Substation,NORT4,Y,PRO-003741
Norton Solar Farm,JBM SOLAR PROJECTS 29 LIMITED,Norton GSP,NORT1,,PRO-001875
Norwich,PIVOTED POWER LLP,Norwich GSP,NORM1,,PRO-001077
Norwich Yare,ASHGREEN ENERGY FARM LIMITED,Norwich GSP,NORM1,,PRO-001076
Great Yarmouth,RWE GENERATION UK PLC,Norwich Main 132kV,NORM1,,PRO-000124
Intwood Farm BESS,Bluestone Energy Ltd,Norwich Main 132kV,NORM1,,PRO-003180
Norwich 100MW BESS,FLEXION ENERGY SPV 2 LTD,Norwich Main 132kV,NORM4,,PRO-002126
GF Norwich BESS,GF Norwich Energy Ltd,Norwich Main 400kV Substation,NORM4,,PRO-003807
Hornsea Power Station 3,ORSTED HORNSEA PROJECT THREE (UK) LIMITED,Norwich Main 400kV Substation,NORM4,,PRO-000434-1
Hornsea Power Station 3,ORSTED HORNSEA PROJECT THREE (UK) LIMITED,Norwich Main 400kV Substation,NORM4,,PRO-000434-2
Norwich 2,EDF ENERGY RENEWABLES LIMITED,Norwich Main 400kV Substation,NORM4,,PRO-002408
Norwich Main BESS,LONG STRATTON ENERGY PARK LIMITED,Norwich Main 400kV Substation,NORM4,,PRO-003894
Scira-Dudgeon Extension,EQUINOR NEW ENERGY LIMITED,Norwich Main 400kV Substation,NORM4,,PRO-000507-1
Scira-Dudgeon Extension,EQUINOR NEW ENERGY LIMITED,Norwich Main 400kV Substation,NORM4,,PRO-000507-2
Scira-Dudgeon Extension,EQUINOR NEW ENERGY LIMITED,Norwich Main 400kV Substation,NORM4,,PRO-000507-3
Norwich Green Energy Centre,NORWICH GREEN ENERGY LIMITED,Norwich Main 400kW Substation,NORM4,,PRO-001771
Havbredey,Northland Power UK Limited,NPI A 275/66kV Offshore Substation,,,PRO-001628
Spiorad Na Mara Offshore Wind Farm,SPIORAD NA MARA LIMITED,NPI C 220/66KV OFFSHORE SUBSTATION,,,PRO-001642
Peak Gen Fareham,PEAK GEN POWER 13 LIMITED,Nursling 132kV Substation,NURS1,,PRO-003901
EPL Hampshire,EPL NEWCO7 LIMITED,Nursling 400kV Substation,NURS4,,PRO-004533
NatPower Nursling Energy Park,NATPOWER MARINE LIMITED,Nursling 400kV Substation,NURS4,,PRO-004190
Nursling Tertiary,NURSLING ENERGY TWO LIMITED,Nursling 400kV Substation,NURS4,,PRO-001051
Conrad (Winchester) Limited,CONRAD (WINCHESTER) LIMITED,Nursling GSP,NURS1,,PRO-004022
Peak Gen Southampton,W4B RENEWABLE ENERGY LIMITED,Nursling GSP,NURS1,,PRO-003902
Oakley,SSE DE SOLAR HOLDCO LIMITED,Oakley 400kV Substation,,,PRO-003818
Ochill BESS,CARLTON POWER LIMITED,Ochill 132kV Substation,,,PRO-002536
Ocker Hill - Gresham House,Gresham House Devco Pipeline Limited,Ocker Hill 275kV Substation,OCKH2,,PRO-002213
Ocker Hill Tertiary Connection,HD143OCK LTD,Ocker Hill 275kV Substation,OCKH2,,PRO-000462
Offerton 200MW BESS,Decerna Limited,Offerton 275kV Substation,OFFE2,,PRO-004910
Old Forest of Ae,SCOTTISHPOWER RENEWABLES (UK) LIMITED,Old Forest of Ae 33kV Substation,,,PRO-001075
Oldbury (Tertiary),PIVOTED POWER LLP,Oldbury 275kV Substation,OLDB2,,PRO-001074-1
Oldbury (Tertiary),PIVOTED POWER LLP,Oldbury 275kV Substation,OLDB2,,PRO-001074-2
Olivers Forest Wind Farm,Oliver Forest Wind Farm Limited,Olivers Forest Wind Farm 132kV Substation,,,PRO-002648
Ormonde Offshore Wind Farm,ORMONDE ENERGY LIMITED,Ormonde 33/132kV Offshore Substation,HEYS1,,PRO-000216
Orrin (part of the Conon Cascade),SSE GENERATION LIMITED,Orrin GSP,ORRI1,,PRO-000178
Monets Garden,MONETS GARDEN BATTERY LTD,Osbaldwick 400kV Substation,OSBA4,,PRO-001082
Osbaldwick PV & BESS Sub,YORK ENERGY PARK LIMITED,Osbaldwick 400kV Substation,OSBA4,,PRO-002582
Galileo 09,GALILEO 09 LIMITED,Oswestry Substation,,,PRO-004798
NatPower Oswestry Green Energy Park,NP SPV 43 Limited,Oswestry Substation,,,PRO-005057
